{
  "schema_version": 1,
  "authority_packet_id": "authority.created.20260430222714",
  "created_at": "2026-04-30T22:27:14.686Z",
  "intent": "Build a made up local ritual engine",
  "domain": "local-ritual-engine",
  "authority_state": "created",
  "references": [
    {
      "id": "created.local-experiment",
      "label": "Created Local Authority Experiment",
      "authority_class": "created",
      "url": null,
      "source_path": ".refer-factory/authority/experiments/local-ritual-engine.md",
      "scope": "Local experimental authority until an official or ratified local source exists."
    }
  ],
  "created_authority": {
    "required": true,
    "reason": "No known official or local authority matched the intent.",
    "experiment_path": ".refer-factory/authority/experiments/local-ritual-engine.md"
  },
  "lineage": {
    "sequence_rank": "SEQ-D",
    "script_id": "refer.authority.resolve",
    "evidence": [
      "created.local-experiment"
    ]
  }
}
